"","Name","Rating_and_Date","Type_of_Purchase","Reviews"
"1","KVIDIO Bluetooth Headphones Over Ear, 65 Hours Playtime Wireless Headphones with Microphone, Foldable Lightweight Headset with Deep Bass,HiFi Stereo Sound for Travel Work PC Cellphone (Black)","4.5 out of 5 stars",NA,"4.5 out of 5 stars"
"2","Rebocico Bluetooth Headphones Over Ear, 6 EQ Modes Wireless Headphones Over Ear,65 Hours Playtime Foldable Lightweight Wireless Headphones,with Built-in HD Mic, FM, SD/TF for PC/Home（Black & Gold）","4.5 out of 5 stars",NA,"4.5 out of 5 stars"
"3","DOQAUS Bluetooth Headphones Over Ear, 90H Playtime, Bluetooth 5.3 Wireless Headphones with 3 EQ Modes, HiFi Stereo Bass Sound, Built-in Mic, Soft Earpad, Foldable Headphones for Phone/PC/Travel(Black)","4.3 out of 5 stars",NA,"4.3 out of 5 stars"
"4","Beats Solo3 Wireless On-Ear Headphones - Apple W1 Headphone Chip, Class 1 Bluetooth, 40 Hours Of Listening Time - Black (Latest Model)","4.7 out of 5 stars",NA,"4.7 out of 5 stars"
"5","Sony WH-XB910N Wireless Noise Cancelling Headphones, EXTRA BASS™, Up to 30 Hours of Battery Life, Over-Ear Design, Optimized for Alexa and Google Assistant, Built-in Mic - Black","4.6 out of 5 stars",NA,"4.6 out of 5 stars"
"6","Moobesthy Wireless Headphones Over Ear, Bluetooth Headphones Over Ear, 60H Playtime Headphones Wireless Bluetooth with 6 EQ Modes, Headphones with Mic","4.3 out of 5 stars",NA,"4.3 out of 5 stars"
"7","WESEARY Wireless Gaming Headsets for PS5, PS4, PC, Switch, Mac, 7.1 Stereo Bluetooth Gaming Headphones with 50mm Drivers, 2.4GHz USB Gamer Headphones with Crystal-Clear Mic, 50Hr Battery, Cool RGB","4.3 out of 5 stars",NA,"4.3 out of 5 stars"
"8","Skullcandy Crusher Evo Over-Ear Wireless Headphones with Sensory Bass, 40 Hr Battery, Microphone, Works with iPhone Android and Bluetooth Devices - Black","4.7 out of 5 stars",NA,"4.7 out of 5 stars"
"9","Beats Solo3 Wireless On-Ear Headphones - Apple W1 Headphone Chip, Class 1 Bluetooth, 40 Hours Of Listening Time - Rose Gold (Latest Model)","4.7 out of 5 stars",NA,"4.7 out of 5 stars"
"10","Uliptz Wireless Bluetooth Headphones, 65H Playtime Over Ear Headphones with Microphone, 6EQ Sound Modes Wireless Headphones, Foldable Bluetooth 5.3 Headphones for Office/Cellphone/PC (Rose Gold)","4.5 out of 5 stars",NA,"4.5 out of 5 stars"
"11","Uliptz Wireless Headphones Over Ear, 65 Hrs Playtime Bluetooth Headphones, 6 EQ Modes Foldable Lightweight Headphones Wireless, Foldable Bluetooth 5.3 Headphones for Travel/Office/PC (Black)","4.5 out of 5 stars",NA,"4.5 out of 5 stars"
"12","DOQAUS Bluetooth Headphones Over Ear, 90 Hrs Playtime Wireless Headphones, 3 EQ Modes, Foldable Hi-Fi Stereo Bass Headphones, Soft Memory Protein Earmuffs, Built-in Mic＆Wired Mode for Phone PC Travel","4.4 out of 5 stars",NA,"4.4 out of 5 stars"
"13","ZIHNIC Bluetooth Headphones Over-Ear, Foldable Wireless and Wired Stereo Headset Micro SD/TF, FM for Cell Phone,PC,Soft Earmuffs &Light Weight for Prolonged Wearing(Rose)","4.5 out of 5 stars",NA,"4.5 out of 5 stars"
"14","Kids Headphones, EarFun Foldable Headphones for kids, 85/94dB Volume Limiter, Sharing Function, Stereo Sound, Adjustable Headband, Wired Children Headphone with mic for School/Travel/Phone, Blue Green","4.6 out of 5 stars",NA,"4.6 out of 5 stars"
"15","Kids Bluetooth Headphones, EarFun Wireless Headphones for Kids, Foldable Headphones with Microphone, Hi-Fi Stereo Sound, 40H Playtime, 85/94dB Volume Limited, Over Ear Headphones for Tablet, Phone, PC","4.6 out of 5 stars",NA,"4.6 out of 5 stars"
"16","Fiauli Wireless Bluetooth Headset,HiFi Foldable Intelligent Noise Reduction Adjustable Wireless Headset,Bluetooth-compatible 5.1 Stereo Over Ear Headphone for Sports Travel Beige","3.8 out of 5 stars",NA,"3.8 out of 5 stars"
"17","Glynzak Wireless Bluetooth Headphones Over Ear - 65H Playtime HiFi Stereo Headset with Microphone and 6EQ Modes Foldable Bluetooth V5.3 Headphones for Travel Smartphone Computer Laptop (Rose Gold)","4.6 out of 5 stars",NA,"4.6 out of 5 stars"
"18","iClever Bluetooth Kids Headphones, BTH12 Colorful LED Lights Kids Wireless Headphones Over Ear with 74/85/94dB Volume Limited, 55H Playtime, Bluetooth 5.2, Built-in Mic for School/Tablet/PC","4.6 out of 5 stars",NA,"4.6 out of 5 stars"
"19","OneOdio A70 Bluetooth Headphones Over Ear, 72 Hrs Playtime, Monitor Level Stereo Sound Quality, Foldable Wireless＆Wired DJ Headphone, Professional Studio Headphones for DJ/TV/PC/Phone","4.5 out of 5 stars",NA,"4.5 out of 5 stars"
"20","iClever Kids Headphones, Wired Headphones for Kids 85dBA Safe Volume Limit, Stereo Sound Foldable Adjustable Over Ear, 3.5mm Jack Boys Girls Childrens Headphones for School/Travel/Tablet/PC, Blue","4.6 out of 5 stars",NA,"4.6 out of 5 stars"
"21","EarFun Bluetooth Kids Headphones, Foldable Headphones for Kids, Bluetooth 5.4 Headphones with Mic, Hi-Fi Stereo Sound, 40H Playtime, 85/94dB Volume Limited, Over Ear Headphones for School, Tablet, PC","4.6 out of 5 stars",NA,"4.6 out of 5 stars"
"22","Rebocico Wireless Headphones, 6 EQ Modes,Headphones Wireless, 65 Hours Playtime Foldable Lightweight Bluetooth Headphones Over Ear with Built-in HD Mic,Deep Bass, FM, SD/TF for PC/Home（Black Blue）","4.5 out of 5 stars",NA,"4.5 out of 5 stars"
"23","iClever Kids Wireless Headphones with LED Lights, BTH18 Safe Volume 74/85/94dBA, 43H Playtime, Stereo Sound, Type-C, AUX Cable, Bluetooth5.3 Over Ear Kids bluetooth Headphones for Tablet/Travel","4.6 out of 5 stars",NA,"4.6 out of 5 stars"
"24","WESEARY Wireless Gaming Headsets with Microphone for PC PS5 PS4 Switch Mac, 7.1 Surround Sound Headset Wireless with 50mm Drivers, 2.4GHz Bluetooth Gaming Headphones, 50Hr Battery, Cool RGB","4.3 out of 5 stars",NA,"4.3 out of 5 stars"
"25",NA,"4 Stars & Up",NA,"4 Stars & Up"
"26","Apple AirPods Pro (2nd generation) with MagSafe Case (USB‑C) ​​​​​​​","4.7 out of 5 stars",NA,"4.7 out of 5 stars"
"27","Apple AirPods with wired Charging Case (2nd generation)","4.7 out of 5 stars",NA,"4.7 out of 5 stars"
"28","soundcore by Anker P20i True Wireless Earbuds, 10mm Drivers with Big Bass, Bluetooth 5.3, 30H Long Playtime, IPX5 Water-Resistant, 2 Mics for AI Clear Calls, 22 Preset EQs, Customization via App","4.5 out of 5 stars",NA,"4.5 out of 5 stars"
"29","Apple EarPods with Lightning Connector - White","4.5 out of 5 stars",NA,"4.5 out of 5 stars"
"30","Apple AirPods (3rd generation) with Lightning Charging Case ​​​​​​​","4.6 out of 5 stars",NA,"4.6 out of 5 stars"
"31","Wireless Earbuds, Bluetooth 5.3 Headphones In Ear with 4 ENC Noise Cancelling Mic, Btootos New Bluetooth Earbuds Mini Deep Bass Stereo Sound, 36H Playtime LED Display Wireless Earphones IP7 Waterproof","4.5 out of 5 stars",NA,"4.5 out of 5 stars"
"32","Wireless Earbuds, Bluetooth 5.3 Headphones in Ear with HiFi Stereo Deep Bass, 4 ENC Noise Cancelling Mic Wireless Earphones 40H Playtime, Bluetooth Earbuds Dual LED Display, IP7 Waterproof, USB-C","4.8 out of 5 stars",NA,"4.8 out of 5 stars"
"33","Wireless Earbuds, Bluetooth 5.3 Headphones In Ear with 4 ENC Noise Cancelling Mic, Btootos 2023 New Bluetooth Earphones Mini Deep Bass Stereo Sound, 36H Playtime LED Display Wireless Earbuds White","4.5 out of 5 stars",NA,"4.5 out of 5 stars"
"34","Wireless Headphones,Wireless Bluetooth 5.3 Earbuds, Touch Control, Easy-Pairing, 24H Playtime,Noise Cancellation Built-in Mic with Charging Case, IPX8 Waterproof Earphones for iphone/Android/IOS","4.6 out of 5 stars",NA,"4.6 out of 5 stars"
"35","Apple EarPods (USB-C) ​​​​​​​","4.6 out of 5 stars",NA,"4.6 out of 5 stars"
"36","Sony WF-C500 True Wireless Headphones (Up to 20 Hours Battery Life with Charging Case - Compatible with Voice Assistant, Built-in Microphone for Phone Calls, Bluetooth) Black","4.3 out of 5 stars",NA,"4.3 out of 5 stars"
"37","JLab Go Air Pop True Wireless Earbuds, Headphones In Ear, Bluetooth Earphones with Microphone, Wireless Ear Buds, TWS Bluetooth Earbuds with Mic, USB Charging Case, Dual Connect, EQ3 Sound, Black","4.3 out of 5 stars",NA,"4.3 out of 5 stars"
"38","Apple AirPods (3rd generation) with MagSafe Charging Case (2021)","4.6 out of 5 stars",NA,"4.6 out of 5 stars"
"39","Wireless Earbuds,Bluetooth 5.3 Headphones In Ear with 4 ENC Noise Cancelling Mic,LED Display 2023 Bluetooth Earbuds Mini Deep Bass Stereo Sound,36H Playtime,Wireless Earphones IP7 Waterproof,Rose Gold","4.5 out of 5 stars",NA,"4.5 out of 5 stars"
"40","Wireless Earbuds, Bluetooth 5.3 Headphones in Ear with 4 ENC Noise Cancelling Mic, Bluetooth Earbuds 40H Playtime, 2023 HiFi Stereo Deep Bass Wireless Earphones, IP7 Waterproof, USB-C Fast Charge","4.5 out of 5 stars",NA,"4.5 out of 5 stars"
"41","Wireless Earbuds, Wireless Headphones Bluetooth 5.3 Headphones with 4 ENC Mic, NEW 40H Bluetooth Earphones in Ear Deep Bass Noise Cancelling Bluetooth Earbuds Mini Ear Buds IP7 Waterproof LED Display","4.6 out of 5 stars",NA,"4.6 out of 5 stars"
"42","Eissix Wireless Earbuds, Bluetooth 5.3 Wireless Earphones with Button Control, Noise Cancelling Mic, 30H Playtime with Charging Case, LED Display, IP7 Waterpoof Headphones for iOS Android Black","4.3 out of 5 stars",NA,"4.3 out of 5 stars"
"43","JBL Tune510BT - Wireless on-ear headphones featuring Bluetooth 5.0, up to 40 hours battery life and speed charge, in black","4.6 out of 5 stars",NA,"4.6 out of 5 stars"
"44","Sony WF-C700N Wireless, Bluetooth, Noise Cancelling Earbuds (Small, Lightweight Earbuds with Multi-Point Connection, IPX4 rating, up to 20 HR battery, Quick Charge, iOS & Android) Black","4.3 out of 5 stars",NA,"4.3 out of 5 stars"
"45","Wireless Earbuds, Bluetooth 5.3 Headphones NEW Wireless Headphones with 4 ENC Mic, 56H Bluetooth Earphones in Ear Noise Cancelling Deep Bass, Mini Ear Buds Bluetooth Earbuds IP7 Waterproof LED Display","4.5 out of 5 stars",NA,"4.5 out of 5 stars"
"46","Sony WF-1000XM5 Wireless Noise Cancelling Headphones, Bluetooth, In-ear Headphones, Mic, Up to 24 Hours Battery Life, Quick Charge, IPX4, iOS & Android Compatible - Black, Small","4.1 out of 5 stars",NA,"4.1 out of 5 stars"
"47","Wireless Earbuds, Bluetooth 5.3 Headphones 2023 Wireless Headphones in Ear with ENC Mic, Bluetooth Earphones Noise Cancelling Ear buds with 50H Hifi Stereo, IP7 Waterproof Headset, USB-C, LED Display","4.7 out of 5 stars",NA,"4.7 out of 5 stars"
"48","EarFun Wireless Earbuds, [What Hi-Fi Awards] Air Bluetooth In-Ear Headphones with 4 Mics ENC, Sweatshield™ IPX7 Waterproof, Clear Sound, Deep Bass, Wireless Charge, Game Mode, App Customize EQ, 35H","4.4 out of 5 stars",NA,"4.4 out of 5 stars"
"49","soundcore Wireless Earbuds, A1 Bluetooth Earbuds, Powerful Customized Sound, 35H Playtime, Wireless Charging, USB-C Fast Charge, IPX7 Waterproof, Button Control, Commute, Sports","4.4 out of 5 stars",NA,"4.4 out of 5 stars"
"50",NA,"4 Stars & Up",NA,"4 Stars & Up"
