"","productsName"
"1","Samsung Galaxy Buds2 Pro, Graphite  "
"2","Linsoul KZ ZS10 Pro, 4BA+1DD 5 Driver in Ear Monitor, HiFi Wired Earbuds, Gaming Earbuds, Hybrid IEM Earphones with Stainless Steel Faceplate, 2 Pin Detachable Cable (Without Mic, Black)  "
"3","Bose QuietComfort Ultra Wireless Noise Cancelling Earbuds, Bluetooth Noise Cancelling Earbuds with Spatial Audio and World-Class Noise Cancellation, Black  "
"4","MOONDROP CHU II High Performance Dynamic Driver IEMs Interchangeable Cable in-Ear Headphone  "
"5","JBL Wave Flex True Wireless Stereo Earbuds, Black  "
"6","soundcore by Anker Liberty 4 NC Wireless Noise Cancelling Earbuds, 98.5% Noise Reduction, Adaptive Noise Cancelling to Ears and Environment, Hi-Res Sound, 50H Battery, Bluetooth 5.3 (Clear White)  "
"7","Soundcore by Anker, Soundcore Sport X10 True Wireless Bluetooth 5.2 Workout Headphones, Rotatable Ear Hooks, Deep Bass, IPX7 Waterproof, Sweatproof, 32H Play, Fast Charge, Sport Earbuds, Gym, Running  "
"8","Moondrop Space Travel TWS Earphone Bluetooth 5.3 Noise Canceling True Wireless Stereo IEMs  "
"9","Samsung Type C Wired in-Ear Earphones  "
"10","soundcore by Anker Space A40 Adaptive Active Noise Cancelling Wireless Earbuds, Reduce Noise by Up to 98%, Ultra Long 50H Playtime, 10H Single Playtime, Hi-Res Sound, Comfortable Fit, Wireless Charge  "
"11","TRUTHEAR x Crinacle Zero: RED Dual Dynamic Drivers in-Ear Headphone  "
"12","Linsoul 7Hz x Crinacle Zero:2 in Ear Monitor, Updated 10mm Dynamic Driver IEM, Wired Earbuds Earphones, Gaming Earbuds, with OFC IEM Cable for Musician (Orange, Without Mic)  "
"13","Moondrop Space Travel TWS Earphone Bluetooth 5.3 Noise Canceling True Wireless Stereo IEMs (Black)  "
"14","Linsoul KZ ZS10 PRO X Upgraded 1DD+4BA Hybrid Driver HiFi in Ear Earphones IEM with Alloy Faceplace Detachable Silver-Plated Recessed 0.75mm 2Pin Cable for Audiophile Musician DJ Stage (with mic)  "
"15","TOZO T18 Bluetooth 5.3 True Wireless Stereo Earphones IPX8 Waterproof in Ear Headset Call Noise Reduction Headphones with Digital Display and Transparent Case Long Standby Earbuds Black  "
"16","Linsoul TANGZU Wan’er S.G HiFi 10mm Dynamic Driver PET Diaphragm in-Ear Earphone with Ergonomic Shape, Detachable 2Pin OFC Braided Cable for Audiophile Musician DJ Stage (Green, with Mic)  "
"17","Bose Ultra Open Earbuds with OpenAudio Technology, Open Ear Wireless Earbuds, Up to 48 Hours of Battery Life, Black  "
"18","Shure SE215 Pro Professional Sound Isolating Earphones (Clear)  "
"19","Nothing Ear (2) Wireless Bluetooth Earphones White - ANC (Active Noise Cancelling) Headphones, Hi-Res Audio Certified, Dual Connection, Powerful 11.6 mm Driver  "
"20","Kuoadusl Wireless Earbuds 3, Wireless Bluetooth 5.2 Headphones 3D HiFi Stereo Headphones Noise Cancellation in-Ear Built-in Mic with Charging Case, Touch Control for Phone/Samsu/Xiaomi/Android/iOS  "
"21","Anker soundcore Life P3 Noise Cancelling Earbuds, Big Bass, 6 Mics, Clear Calls, Multi Mode Noise Cancelling, Wireless Charging, Soundcore App with Gaming Mode, Sleeping Mode, Find Your Earbuds  "
"22","Samsung 3.5mm Earphone (EO-IA500), Black  "
"23","Nokia Essential E3110 Wireless Earbuds, Bluetooth 5.1, Fully Wireless Earbuds, ENC Noise Reduction, Hands-Free Calling, Left/Right Separated, Up to 25 Hours of Music Playback, Lightweight, Black  "
"24","Linsoul SIMGOT EM6L 1DD + 4BA Hybrid Driver in-Ear Monitor, Gaming Earbud, HiFi IEM Earphone with 3D-Printed Resin Housing, Detachable OFC Silver-Plated Cable (Black, SIMGOT EM6L)  "
"25","Sony In-Ear Lightweight Headphones, White  "
"26","Linsoul 7Hz Salnotes Zero HiFi 10mm Dynamic Driver in-Ear Earphone, IEM with Metal Composite Diaphragm, Stainless Steel Faceplate Detachable 2Pin OFC Cable (Black, Without Mic)  "
"27","Belkin Rockstar iPhone Headphones with Lightning Connector (Lightning Headphones for iPhone, Lightning Earphones for iPhone), Black, (G3H0001btBLK)  "
"28","Laser Wireless Bluetooth Earphones in White - Long-Lasting Battery, Inline Controls, Secure Fit, Magnet Feature, Comfort Foam, Advanced Audio Distribution  "
"29","Linsoul KZ ZS10 Pro, 4BA+1DD 5 Driver in Ear Monitor, HiFi Wired Earbuds, Gaming Earbuds, Hybrid IEM Earphones with Stainless Steel Faceplate, 2 Pin Detachable Cable (with Mic, Dark Black)  "
"30","True Wireless Sleep Earbuds, Damipow Noise Blocking Technology Bluetooth Headphones in-Ear, Smallest and Lightest, Ultra Comfortable Designed Specifically to Help You Asleep Faster and Sleep Better  "
"31","Linsoul SIMGOT EW200 10mm SCP Diaphragm Dynamic Driver in-Ear Earphones with All Metal Body, Detachable 0.78mm 2pin Silver-Plated OFC Cable for Audiophiles Musicians  "
"32","Linsoul KZ ZSN Pro X Dual Driver 1BA+1DD Hybrid Metal Earphones HiFi in-Ear Monitor with Detachable 2Pin Cable, Zin Alloy Panel (Without Mic, ZSN Prox-Black)  "
"33","Philips EarHook Sports Wired Headset with Mic  "
"34","Nokia Wireless Earbuds, Bluetooth 5.3 Earphones in Ear with Dual ENC Noise Cancelling Mic,Touch Control Earbuds Deep Bass Stereo Sound, 20H Playtime Wireless Headphones, Black E3102Plus (Black)  "
"35","Nokia Essential E3110 Wireless Earbuds, Bluetooth 5.1, Fully Wireless Earbuds, ENC Noise Reduction, Hands-Free Calling, Left/Right Separated, Up to 25 Hours of Music Playback, Lightweight, Green  "
"36","KZ ZS10 Pro 4BA 1DD KZ Earphones Multi Driver HiFi Monitors, KZ in Ear Earphone IEM with 2Pin 0.75mm 3.5MM Plug Detachable Cable with Microphone (Black with Mic)  "
"37","Laser Earbud Headphones Earphones Blue 3.5mm  "
"38","Linsoul KZ ZSN Pro Dual Driver 1BA+1DD Hybrid Metal Earphones HiFi in-Ear Monitor with Detachable 2Pin Cable, Zin Alloy Panel (Without Mic, Black)  "
"39","2 Packs-USB C Headphones Type C Earbuds for iPhone 15 Pro Max Galaxy S23/S22/S21/S20/Ultra Note 10/20 Pixel 7/6/6a/5/4, Wired Earphones with Mic & Volume Control for iPad Pro Pixel 6 6a 7 OnePlus 9 8  "
"40","Samsung EO-IC100 USB Type-C Headphones - Sound from AKG - Black  "
"41","TELLUR VOX 55 Bluetooth Headset, Handsfree Earpiece, BT v5.2, Multipoint Two Simultaneous Connected Devices, 360° Hook for Right or Left Ear, iPhone and Android  "
"42","House of Marley Smile Jamaica in-Ear - Signature Black  "
"43","Skullcandy Dime 3 in-Ear Wireless Headphones, 20 Hours Battery Life, Micro, Compatible with iPhone, Android and Bluetooth Devices - Black  "
"44","MEE audio M6 PRO in Ear Monitor Headphones for Musicians, 2nd Gen Model with Upgraded Sound, Memory Wire Earhooks & Replaceable Cables, Noise Isolating Professional Earbuds, 2 Cords Included (Clear)  "
"45","JVC HA-A10T-BU Truly Wireless in-Ear Bluetooth Headphones with Memory Foam Earpieces, Charcoal-Black (Waterproof IPX5, 4 + 10 Hours Battery Life)  "
"46","SoundPEATS Air3 Wireless Earbuds Mini Bluetooth V5.2 Earphones with Qualcomm QCC3040 and aptX-Adaptive, 4-Mic and CVC 8.0 Noise Cancellation, TrueWireless Mirroring Tech, in-Ear Detection, Game Mode  "
"47","Gillette Fusion5 Men's Razor Blade Refills, 10 count + Gillette Fusion5 Proglide Blade Refills, 2 count  "
"48","TOZO T12 Pro Wireless Earbuds Bluetooth Headphones with Qualcomm QCC3040 4 Mics CVC 8.0 Call Noise Cancelling and aptX Stereo Headset 2500mAh Wireless Charging Case IPX8 Waterproof Earphones Black  "
"49","CCZ Melody in-Ear Earphones Headphones Yinyoo Wired Earbuds Without Microphone Ear Monitors IEM HiFi Bass with 1DD 1BA, Ear fins, 4N OFC Cable for Musicians,Singer,Stage(Without mic, Clear Black)  "
"50","JBL Live Flex ANC True Wireless Stereo Earbuds, Rose  "
